{
  "schemaVersion": 1,
  "trackId": "3f9a2b1c-8d7e-4f60-a1b2-c3d4e5f60718",
  "slug": "spring-trail",
  "name": {
    "he": "שביל המעיין",
    "en": "The Spring Trail"
  },
  "description": {
    "he": "מסלול חידות מעגלי בפארק הטבע עין דרור: שבע תחנות, כשעה של הליכה, וחידות על המעיין, העצים ובעלי החיים של העמק. מתאים למשפחות עם ילדים מגיל 8.",
    "en": "A circular riddle trail through Ein Dror Nature Park: seven stations, about an hour of walking, and riddles about the spring, the trees, and the animals of the valley. Suited to families with children aged 8 and up."
  },
  "coverMediaId": null,
  "languages": ["he", "en"],
  "defaultLanguage": "he",
  "difficulty": "easy",
  "minAge": 8,
  "estimate": {
    "durationMinutes": 70,
    "distanceMeters": 1750
  },
  "safetyNotes": {
    "he": "הישארו על השבילים המסומנים. הבריכה עמוקה — ילדים חייבים ללכת בליווי מבוגר. קחו מים וכובע. במקרה חירום: משטרה 100, מד״א 101.",
    "en": "Stay on the marked paths. The pool is deep — children must be accompanied by an adult. Bring water and a hat. In an emergency: police 100, ambulance 101."
  },
  "rules": {
    "order": "linear",
    "visibility": "progressive",
    "revealAndContinue": "afterFirstHint",
    "wrongChoicePenaltyPercent": 25,
    "timeBonus": null,
    "leaderboard": true
  },
  "media": [],
  "legs": [
    {
      "id": "9b8c7d6e-5f40-4a31-b2c3-d4e5f6071829",
      "name": {
        "he": "שביל המעיין",
        "en": "The Spring Trail"
      },
      "intro": [
        {
          "type": "paragraph",
          "text": {
            "he": "המסלול מתחיל בשער הישן ומסתיים בבריכה, הליכה קצרה מהשער שבו התחלתם. בכל תחנה מחכה לכם סיפור קצר וחידה אחת. פתרתם? תקבלו רמז למיקום התחנה הבאה.",
            "en": "The trail starts at the Old Gate and ends at the Pool, a short walk from the gate where you began. At every station a short story and one riddle are waiting. Solve it, and you get a clue to where the next station is."
          }
        }
      ],
      "outro": [
        {
          "type": "paragraph",
          "text": {
            "he": "סיימתם את שביל המעיין! השאירו את הפארק נקי כפי שמצאתם אותו, ובואו שוב באביב — אז הסלמנדרות יוצאות.",
            "en": "You've finished the Spring Trail! Leave the park as clean as you found it, and come back in spring — that's when the salamanders come out."
          }
        }
      ],
      "map": {
        "kind": "tiles",
        "bounds": [34.802, 32.095, 34.818, 32.106],
        "minZoom": 13,
        "maxZoom": 18
      },
      "stations": [
        {
          "id": "0a1b2c3d-4e5f-4061-8a9b-0c1d2e3f4a5b",
          "title": {
            "he": "השער הישן",
            "en": "The Old Gate"
          },
          "intro": [
            {
              "type": "paragraph",
              "text": {
                "he": "ברוכים הבאים לפארק הטבע עין דרור. שער הברזל שלפניכם הוצב כאן בשנת 1932, כשמי המעיין השקו פרדסי הדרים בכל רחבי העמק. החקלאים עברו בו כל בוקר עם פרדות וארגזים ריקים, וכל ערב עם ארגזים מלאים.",
                "en": "Welcome to Ein Dror Nature Park. The iron gate in front of you was put up in 1932, when the spring watered citrus orchards across the whole valley. Farmers passed through it every morning with mules and empty crates, and every evening with full ones."
              }
            }
          ],
          "location": { "lat": 32.099, "lng": 34.806 },
          "arrival": { "methods": [], "automatic": false, "radiusMeters": 30 },
          "challenge": {
            "type": "number",
            "prompt": {
              "he": "השער הוצב בשנת 1932. כמה שנים הוא עומד כאן? (השנה עכשיו 2026.)",
              "en": "The gate was put up in 1932. How many years has it been standing here? (The year now is 2026.)"
            },
            "answer": 94,
            "tolerance": { "kind": "absolute", "value": 0 },
            "unit": { "he": "שנים", "en": "years" }
          },
          "hints": [
            {
              "text": {
                "he": "חסרו את שנת הצבת השער מהשנה הנוכחית.",
                "en": "Subtract the year the gate was built from the current year."
              },
              "cost": 20
            },
            {
              "text": {
                "he": "2026 פחות 1932.",
                "en": "2026 minus 1932."
              },
              "cost": 30
            },
            {
              "text": {
                "he": "זה תשעים ומשהו.",
                "en": "It's ninety-something."
              },
              "cost": 50
            }
          ],
          "points": 100,
          "reveal": { "as": "pin", "distanceFeedback": false }
        },
        {
          "id": "1b2c3d4e-5f60-4172-9bac-1d2e3f4a5b6c",
          "title": {
            "he": "המעיין",
            "en": "The Spring"
          },
          "intro": [
            {
              "type": "paragraph",
              "text": {
                "he": "זהו עין דרור — המעיין שהעניק לפארק את שמו. מימיו קרירים כל השנה. בתחילת האביב, הסתכלו היטב ליד הסלעים הרטובים: כאן חיה הסלמנדרה, שחורה עם כתמים צהובים בוהקים. הצבעים האלה אינם קישוט — הם מזהירים טורפים שעורה רעיל.",
                "en": "This is Ein Dror — the spring that gave the park its name. Its water stays cool all year round. In early spring, look carefully near the wet rocks: the fire salamander lives here, black with bright yellow spots. Those colors are not decoration — they warn predators that its skin is poisonous."
              }
            }
          ],
          "location": { "lat": 32.0998, "lng": 34.8082 },
          "arrival": { "methods": [], "automatic": false, "radiusMeters": 30 },
          "challenge": {
            "type": "choice",
            "prompt": {
              "he": "מדוע הסלמנדרה צבעונית כל כך?",
              "en": "Why is the salamander so brightly colored?"
            },
            "options": [
              { "id": "mate", "text": { "he": "כדי למשוך בן זוג", "en": "To attract a mate" } },
              { "id": "warn", "text": { "he": "כדי להזהיר טורפים שהיא רעילה", "en": "To warn predators that it is poisonous" } },
              { "id": "blend", "text": { "he": "כדי להסתוות בין פרחים צהובים", "en": "To blend in with yellow flowers" } },
              { "id": "sun", "text": { "he": "כדי לספוג יותר אור שמש", "en": "To absorb more sunlight" } }
            ],
            "correctOptionId": "warn",
            "shuffle": true
          },
          "hints": [
            {
              "text": { "he": "זה לא קשור ליופי.", "en": "It isn't about looking pretty." },
              "cost": 20
            },
            {
              "text": { "he": "העור שלה לא בטוח לאכילה.", "en": "Its skin is not safe to eat." },
              "cost": 30
            },
            {
              "text": { "he": "צבעים בוהקים בטבע הם לעיתים קרובות אזהרה.", "en": "Bright colors in nature are often a warning." },
              "cost": 50
            }
          ],
          "points": 100,
          "reveal": {
            "as": "clue",
            "clue": {
              "text": {
                "he": "לכו בעקבות קול המים. במקום שבו מתחיל סיפורו של העמק — שם תמצאו אותי.",
                "en": "Follow the sound of water. Where the valley's story begins, you'll find me."
              }
            },
            "distanceFeedback": true
          }
        },
        {
          "id": "2c3d4e5f-6071-4283-abcd-2e3f4a5b6c7d",
          "title": {
            "he": "האלון העתיק",
            "en": "The Ancient Oak"
          },
          "intro": [
            {
              "type": "paragraph",
              "text": {
                "he": "אלון התבור הזה בן כ-300 שנה, לפי ההערכה. בכל סתיו הוא משיר אלפי בלוטים. רובם נאכלים — אבל העורבני, ציפור רעשנית ממשפחת העורבים עם כתם כחול על הכנף, טומן בלוטים באדמה כדי לאכול אותם מאוחר יותר, ושוכח חלק מהם. מהבלוטים שנשכחו צומחים אלונים חדשים.",
                "en": "This Tabor oak is thought to be about 300 years old. Every autumn it drops thousands of acorns. Most are eaten — but the jay, a noisy bird of the crow family with a flash of blue on its wing, buries acorns to eat later and forgets some of them. Those forgotten acorns become new oaks."
              }
            }
          ],
          "location": { "lat": 32.101, "lng": 34.81 },
          "arrival": { "methods": [], "automatic": false, "radiusMeters": 30 },
          "challenge": {
            "type": "text",
            "prompt": {
              "he": "איזו ציפור נוטעת אלונים חדשים כשהיא טומנת בלוטים ושוכחת אותם?",
              "en": "Which bird plants new oaks by burying acorns and forgetting them?"
            },
            "accepted": {
              "he": ["עורבני", "העורבני", "עורבנים", "העורבנים"],
              "en": ["jay", "jays", "the jay", "a jay", "eurasian jay"]
            },
            "closeMatch": true,
            "placeholder": { "he": "שם הציפור", "en": "Name of the bird" }
          },
          "hints": [
            {
              "text": { "he": "זו ציפור ממשפחת העורבים.", "en": "It's a bird from the crow family." },
              "cost": 20
            },
            {
              "text": { "he": "יש לה כתם כחול על הכנף.", "en": "It has a patch of blue on its wing." },
              "cost": 30
            },
            {
              "text": { "he": "שמה מתחיל באות ע׳.", "en": "Its name begins with J." },
              "cost": 50
            }
          ],
          "points": 100,
          "reveal": {
            "as": "clue",
            "clue": {
              "text": {
                "he": "אני היצור החי הזקן ביותר בפארק. חפשו את הגזע הרחב ביותר ועמדו בצילי.",
                "en": "I am the oldest living thing in the park. Look for the widest trunk, and stand in my shade."
              }
            },
            "distanceFeedback": true
          }
        },
        {
          "id": "3d4e5f60-7182-4394-8cde-3f4a5b6c7d8e",
          "title": {
            "he": "התצפית",
            "en": "The Lookout"
          },